No.     Time           Source                Destination           Protocol Length SEQ#       NEXT SEQ#  ACK#       Info                                                            Host       HTTP delta Stream index
      1 0.000000       24.6.173.220          173.194.79.121        TCP      66     0          1          0          61598 → 80 [SYN] Seq=0 Win=8192 Len=0 MSS=1460 WS=4 SACK_PERM                       0

Frame 1: 66 bytes on wire (528 bits), 66 bytes captured (528 bits) on interface \Device\NPF_{6E79FEC0-FF79-4970-96E4-EEFF300A9B9F}, id 0
Ethernet II, Src: HewlettP_a7:bf:a3 (d4:85:64:a7:bf:a3), Dst: Cadant_31:bb:c1 (00:01:5c:31:bb:c1)
Internet Protocol Version 4, Src: 24.6.173.220, Dst: 173.194.79.121
Transmission Control Protocol, Src Port: 61598, Dst Port: 80, Seq: 0, Len: 0

No.     Time           Source                Destination           Protocol Length SEQ#       NEXT SEQ#  ACK#       Info                                                            Host       HTTP delta Stream index
      2 0.035945       173.194.79.121        24.6.173.220          TCP      66     0          1          1          80 → 61598 [SYN, ACK] Seq=0 Ack=1 Win=14300 Len=0 MSS=1430 SACK_PERM WS=64                       0

Frame 2: 66 bytes on wire (528 bits), 66 bytes captured (528 bits) on interface \Device\NPF_{6E79FEC0-FF79-4970-96E4-EEFF300A9B9F}, id 0
Ethernet II, Src: Cadant_31:bb:c1 (00:01:5c:31:bb:c1), Dst: HewlettP_a7:bf:a3 (d4:85:64:a7:bf:a3)
Internet Protocol Version 4, Src: 173.194.79.121, Dst: 24.6.173.220
Transmission Control Protocol, Src Port: 80, Dst Port: 61598, Seq: 0, Ack: 1, Len: 0

No.     Time           Source                Destination           Protocol Length SEQ#       NEXT SEQ#  ACK#       Info                                                            Host       HTTP delta Stream index
      3 0.036067       24.6.173.220          173.194.79.121        TCP      54     1          1          1          61598 → 80 [ACK] Seq=1 Ack=1 Win=65780 Len=0                                        0

Frame 3: 54 bytes on wire (432 bits), 54 bytes captured (432 bits) on interface \Device\NPF_{6E79FEC0-FF79-4970-96E4-EEFF300A9B9F}, id 0
Ethernet II, Src: HewlettP_a7:bf:a3 (d4:85:64:a7:bf:a3), Dst: Cadant_31:bb:c1 (00:01:5c:31:bb:c1)
Internet Protocol Version 4, Src: 24.6.173.220, Dst: 173.194.79.121
Transmission Control Protocol, Src Port: 61598, Dst Port: 80, Seq: 1, Ack: 1, Len: 0

No.     Time           Source                Destination           Protocol Length SEQ#       NEXT SEQ#  ACK#       Info                                                            Host       HTTP delta Stream index
      4 0.036487       24.6.173.220          173.194.79.121        HTTP     376    1          323        1          GET /api/supported-services.json HTTP/1.1                       www.longurlplease.com            0

Frame 4: 376 bytes on wire (3008 bits), 376 bytes captured (3008 bits) on interface \Device\NPF_{6E79FEC0-FF79-4970-96E4-EEFF300A9B9F}, id 0
Ethernet II, Src: HewlettP_a7:bf:a3 (d4:85:64:a7:bf:a3), Dst: Cadant_31:bb:c1 (00:01:5c:31:bb:c1)
Internet Protocol Version 4, Src: 24.6.173.220, Dst: 173.194.79.121
Transmission Control Protocol, Src Port: 61598, Dst Port: 80, Seq: 1, Ack: 1, Len: 322
Hypertext Transfer Protocol

No.     Time           Source                Destination           Protocol Length SEQ#       NEXT SEQ#  ACK#       Info                                                            Host       HTTP delta Stream index
      5 0.072022       173.194.79.121        24.6.173.220          TCP      60     1          1          323        80 → 61598 [ACK] Seq=1 Ack=323 Win=15424 Len=0                                      0

Frame 5: 60 bytes on wire (480 bits), 60 bytes captured (480 bits) on interface \Device\NPF_{6E79FEC0-FF79-4970-96E4-EEFF300A9B9F}, id 0
Ethernet II, Src: Cadant_31:bb:c1 (00:01:5c:31:bb:c1), Dst: HewlettP_a7:bf:a3 (d4:85:64:a7:bf:a3)
Internet Protocol Version 4, Src: 173.194.79.121, Dst: 24.6.173.220
Transmission Control Protocol, Src Port: 80, Dst Port: 61598, Seq: 1, Ack: 323, Len: 0

No.     Time           Source                Destination           Protocol Length SEQ#       NEXT SEQ#  ACK#       Info                                                            Host       HTTP delta Stream index
      6 0.074280       173.194.79.121        24.6.173.220          HTTP/JSON 1180   1          1127       323        HTTP/1.1 200 OK , JavaScript Object Notation (application/json)            0.037793000 0

Frame 6: 1180 bytes on wire (9440 bits), 1180 bytes captured (9440 bits) on interface \Device\NPF_{6E79FEC0-FF79-4970-96E4-EEFF300A9B9F}, id 0
Ethernet II, Src: Cadant_31:bb:c1 (00:01:5c:31:bb:c1), Dst: HewlettP_a7:bf:a3 (d4:85:64:a7:bf:a3)
Internet Protocol Version 4, Src: 173.194.79.121, Dst: 24.6.173.220
Transmission Control Protocol, Src Port: 80, Dst Port: 61598, Seq: 1, Ack: 323, Len: 1126
Hypertext Transfer Protocol
JavaScript Object Notation: application/json

No.     Time           Source                Destination           Protocol Length SEQ#       NEXT SEQ#  ACK#       Info                                                            Host       HTTP delta Stream index
      7 0.270033       24.6.173.220          173.194.79.121        TCP      54     323        323        1127       61598 → 80 [ACK] Seq=323 Ack=1127 Win=64652 Len=0                                   0

Frame 7: 54 bytes on wire (432 bits), 54 bytes captured (432 bits) on interface \Device\NPF_{6E79FEC0-FF79-4970-96E4-EEFF300A9B9F}, id 0
Ethernet II, Src: HewlettP_a7:bf:a3 (d4:85:64:a7:bf:a3), Dst: Cadant_31:bb:c1 (00:01:5c:31:bb:c1)
Internet Protocol Version 4, Src: 24.6.173.220, Dst: 173.194.79.121
Transmission Control Protocol, Src Port: 61598, Dst Port: 80, Seq: 323, Ack: 1127, Len: 0

No.     Time           Source                Destination           Protocol Length SEQ#       NEXT SEQ#  ACK#       Info                                                            Host       HTTP delta Stream index
      8 9.700260       24.6.173.220          75.75.75.75           DNS      76                                      Standard query 0xe984 A www.china.org.cn                                              

Frame 8: 76 bytes on wire (608 bits), 76 bytes captured (608 bits) on interface \Device\NPF_{6E79FEC0-FF79-4970-96E4-EEFF300A9B9F}, id 0
Ethernet II, Src: HewlettP_a7:bf:a3 (d4:85:64:a7:bf:a3), Dst: Cadant_31:bb:c1 (00:01:5c:31:bb:c1)
Internet Protocol Version 4, Src: 24.6.173.220, Dst: 75.75.75.75
User Datagram Protocol, Src Port: 58521, Dst Port: 53
Domain Name System (query)

No.     Time           Source                Destination           Protocol Length SEQ#       NEXT SEQ#  ACK#       Info                                                            Host       HTTP delta Stream index
      9 9.712147       75.75.75.75           24.6.173.220          DNS      214                                     Standard query response 0xe984 A www.china.org.cn CNAME www.china.org.chinacache.net CNAME www.china.org.cnc.ccgslb.net CNAME webcache.foreign.ccgslb.com A 209.177.86.18                       

Frame 9: 214 bytes on wire (1712 bits), 214 bytes captured (1712 bits) on interface \Device\NPF_{6E79FEC0-FF79-4970-96E4-EEFF300A9B9F}, id 0
Ethernet II, Src: Cadant_31:bb:c1 (00:01:5c:31:bb:c1), Dst: HewlettP_a7:bf:a3 (d4:85:64:a7:bf:a3)
Internet Protocol Version 4, Src: 75.75.75.75, Dst: 24.6.173.220
User Datagram Protocol, Src Port: 53, Dst Port: 58521
Domain Name System (response)

No.     Time           Source                Destination           Protocol Length SEQ#       NEXT SEQ#  ACK#       Info                                                            Host       HTTP delta Stream index
     10 9.712881       24.6.173.220          75.75.75.75           DNS      76                                      Standard query 0x9282 AAAA www.china.org.cn                                           

Frame 10: 76 bytes on wire (608 bits), 76 bytes captured (608 bits) on interface \Device\NPF_{6E79FEC0-FF79-4970-96E4-EEFF300A9B9F}, id 0
Ethernet II, Src: HewlettP_a7:bf:a3 (d4:85:64:a7:bf:a3), Dst: Cadant_31:bb:c1 (00:01:5c:31:bb:c1)
Internet Protocol Version 4, Src: 24.6.173.220, Dst: 75.75.75.75
User Datagram Protocol, Src Port: 52557, Dst Port: 53
Domain Name System (query)

No.     Time           Source                Destination           Protocol Length SEQ#       NEXT SEQ#  ACK#       Info                                                            Host       HTTP delta Stream index
     11 9.726488       75.75.75.75           24.6.173.220          DNS      243                                     Standard query response 0x9282 AAAA www.china.org.cn CNAME www.china.org.chinacache.net CNAME www.china.org.cnc.ccgslb.net CNAME webcache.foreign.ccgslb.com SOA ns1.ccgslb.com                       

Frame 11: 243 bytes on wire (1944 bits), 243 bytes captured (1944 bits) on interface \Device\NPF_{6E79FEC0-FF79-4970-96E4-EEFF300A9B9F}, id 0
Ethernet II, Src: Cadant_31:bb:c1 (00:01:5c:31:bb:c1), Dst: HewlettP_a7:bf:a3 (d4:85:64:a7:bf:a3)
Internet Protocol Version 4, Src: 75.75.75.75, Dst: 24.6.173.220
User Datagram Protocol, Src Port: 53, Dst Port: 52557
Domain Name System (response)

No.     Time           Source                Destination           Protocol Length SEQ#       NEXT SEQ#  ACK#       Info                                                            Host       HTTP delta Stream index
     12 9.727620       24.6.173.220          209.177.86.18         TCP      66     0          1          0          61599 → 80 [SYN] Seq=0 Win=8192 Len=0 MSS=1460 WS=4 SACK_PERM                       1

Frame 12: 66 bytes on wire (528 bits), 66 bytes captured (528 bits) on interface \Device\NPF_{6E79FEC0-FF79-4970-96E4-EEFF300A9B9F}, id 0
Ethernet II, Src: HewlettP_a7:bf:a3 (d4:85:64:a7:bf:a3), Dst: Cadant_31:bb:c1 (00:01:5c:31:bb:c1)
Internet Protocol Version 4, Src: 24.6.173.220, Dst: 209.177.86.18
Transmission Control Protocol, Src Port: 61599, Dst Port: 80, Seq: 0, Len: 0

No.     Time           Source                Destination           Protocol Length SEQ#       NEXT SEQ#  ACK#       Info                                                            Host       HTTP delta Stream index
     13 9.812805       209.177.86.18         24.6.173.220          TCP      66     0          1          1          80 → 61599 [SYN, ACK] Seq=0 Ack=1 Win=4380 Len=0 MSS=1460 SACK_PERM WS=128                       1

Frame 13: 66 bytes on wire (528 bits), 66 bytes captured (528 bits) on interface \Device\NPF_{6E79FEC0-FF79-4970-96E4-EEFF300A9B9F}, id 0
Ethernet II, Src: Cadant_31:bb:c1 (00:01:5c:31:bb:c1), Dst: HewlettP_a7:bf:a3 (d4:85:64:a7:bf:a3)
Internet Protocol Version 4, Src: 209.177.86.18, Dst: 24.6.173.220
Transmission Control Protocol, Src Port: 80, Dst Port: 61599, Seq: 0, Ack: 1, Len: 0

No.     Time           Source                Destination           Protocol Length SEQ#       NEXT SEQ#  ACK#       Info                                                            Host       HTTP delta Stream index
     14 9.813017       24.6.173.220          209.177.86.18         TCP      54     1          1          1          61599 → 80 [ACK] Seq=1 Ack=1 Win=65700 Len=0                                        1

Frame 14: 54 bytes on wire (432 bits), 54 bytes captured (432 bits) on interface \Device\NPF_{6E79FEC0-FF79-4970-96E4-EEFF300A9B9F}, id 0
Ethernet II, Src: HewlettP_a7:bf:a3 (d4:85:64:a7:bf:a3), Dst: Cadant_31:bb:c1 (00:01:5c:31:bb:c1)
Internet Protocol Version 4, Src: 24.6.173.220, Dst: 209.177.86.18
Transmission Control Protocol, Src Port: 61599, Dst Port: 80, Seq: 1, Ack: 1, Len: 0

No.     Time           Source                Destination           Protocol Length SEQ#       NEXT SEQ#  ACK#       Info                                                            Host       HTTP delta Stream index
     15 9.814006       24.6.173.220          209.177.86.18         HTTP     344    1          291        1          GET / HTTP/1.1                                                  www.china.org.cn            1

Frame 15: 344 bytes on wire (2752 bits), 344 bytes captured (2752 bits) on interface \Device\NPF_{6E79FEC0-FF79-4970-96E4-EEFF300A9B9F}, id 0
Ethernet II, Src: HewlettP_a7:bf:a3 (d4:85:64:a7:bf:a3), Dst: Cadant_31:bb:c1 (00:01:5c:31:bb:c1)
Internet Protocol Version 4, Src: 24.6.173.220, Dst: 209.177.86.18
Transmission Control Protocol, Src Port: 61599, Dst Port: 80, Seq: 1, Ack: 1, Len: 290
Hypertext Transfer Protocol

No.     Time           Source                Destination           Protocol Length SEQ#       NEXT SEQ#  ACK#       Info                                                            Host       HTTP delta Stream index
     16 9.901496       209.177.86.18         24.6.173.220          TCP      60     1          1          291        80 → 61599 [ACK] Seq=1 Ack=291 Win=5504 Len=0                                       1

Frame 16: 60 bytes on wire (480 bits), 60 bytes captured (480 bits) on interface \Device\NPF_{6E79FEC0-FF79-4970-96E4-EEFF300A9B9F}, id 0
Ethernet II, Src: Cadant_31:bb:c1 (00:01:5c:31:bb:c1), Dst: HewlettP_a7:bf:a3 (d4:85:64:a7:bf:a3)
Internet Protocol Version 4, Src: 209.177.86.18, Dst: 24.6.173.220
Transmission Control Protocol, Src Port: 80, Dst Port: 61599, Seq: 1, Ack: 291, Len: 0

No.     Time           Source                Destination           Protocol Length SEQ#       NEXT SEQ#  ACK#       Info                                                            Host       HTTP delta Stream index
     17 9.902302       209.177.86.18         24.6.173.220          HTTP     400    1          347        291        HTTP/1.0 200 OK                                                            0.088296000 1

Frame 17: 400 bytes on wire (3200 bits), 400 bytes captured (3200 bits) on interface \Device\NPF_{6E79FEC0-FF79-4970-96E4-EEFF300A9B9F}, id 0
Ethernet II, Src: Cadant_31:bb:c1 (00:01:5c:31:bb:c1), Dst: HewlettP_a7:bf:a3 (d4:85:64:a7:bf:a3)
Internet Protocol Version 4, Src: 209.177.86.18, Dst: 24.6.173.220
Transmission Control Protocol, Src Port: 80, Dst Port: 61599, Seq: 1, Ack: 291, Len: 346
Hypertext Transfer Protocol

No.     Time           Source                Destination           Protocol Length SEQ#       NEXT SEQ#  ACK#       Info                                                            Host       HTTP delta Stream index
     18 9.903533       209.177.86.18         24.6.173.220          HTTP     1514   347        1807       291        Continuation                                                                          1

Frame 18: 1514 bytes on wire (12112 bits), 1514 bytes captured (12112 bits) on interface \Device\NPF_{6E79FEC0-FF79-4970-96E4-EEFF300A9B9F}, id 0
Ethernet II, Src: Cadant_31:bb:c1 (00:01:5c:31:bb:c1), Dst: HewlettP_a7:bf:a3 (d4:85:64:a7:bf:a3)
Internet Protocol Version 4, Src: 209.177.86.18, Dst: 24.6.173.220
Transmission Control Protocol, Src Port: 80, Dst Port: 61599, Seq: 347, Ack: 291, Len: 1460
Hypertext Transfer Protocol

No.     Time           Source                Destination           Protocol Length SEQ#       NEXT SEQ#  ACK#       Info                                                            Host       HTTP delta Stream index
     19 9.903537       209.177.86.18         24.6.173.220          HTTP     1514   1807       3267       291        Continuation                                                                          1

Frame 19: 1514 bytes on wire (12112 bits), 1514 bytes captured (12112 bits) on interface \Device\NPF_{6E79FEC0-FF79-4970-96E4-EEFF300A9B9F}, id 0
Ethernet II, Src: Cadant_31:bb:c1 (00:01:5c:31:bb:c1), Dst: HewlettP_a7:bf:a3 (d4:85:64:a7:bf:a3)
Internet Protocol Version 4, Src: 209.177.86.18, Dst: 24.6.173.220
Transmission Control Protocol, Src Port: 80, Dst Port: 61599, Seq: 1807, Ack: 291, Len: 1460
Hypertext Transfer Protocol

No.     Time           Source                Destination           Protocol Length SEQ#       NEXT SEQ#  ACK#       Info                                                            Host       HTTP delta Stream index
     20 9.903542       209.177.86.18         24.6.173.220          HTTP     1514   3267       4727       291        Continuation                                                                          1

Frame 20: 1514 bytes on wire (12112 bits), 1514 bytes captured (12112 bits) on interface \Device\NPF_{6E79FEC0-FF79-4970-96E4-EEFF300A9B9F}, id 0
Ethernet II, Src: Cadant_31:bb:c1 (00:01:5c:31:bb:c1), Dst: HewlettP_a7:bf:a3 (d4:85:64:a7:bf:a3)
Internet Protocol Version 4, Src: 209.177.86.18, Dst: 24.6.173.220
Transmission Control Protocol, Src Port: 80, Dst Port: 61599, Seq: 3267, Ack: 291, Len: 1460
Hypertext Transfer Protocol

No.     Time           Source                Destination           Protocol Length SEQ#       NEXT SEQ#  ACK#       Info                                                            Host       HTTP delta Stream index
     21 9.905060       24.6.173.220          209.177.86.18         TCP      54     291        291        4727       61599 → 80 [ACK] Seq=291 Ack=4727 Win=65700 Len=0                                   1

Frame 21: 54 bytes on wire (432 bits), 54 bytes captured (432 bits) on interface \Device\NPF_{6E79FEC0-FF79-4970-96E4-EEFF300A9B9F}, id 0
Ethernet II, Src: HewlettP_a7:bf:a3 (d4:85:64:a7:bf:a3), Dst: Cadant_31:bb:c1 (00:01:5c:31:bb:c1)
Internet Protocol Version 4, Src: 24.6.173.220, Dst: 209.177.86.18
Transmission Control Protocol, Src Port: 61599, Dst Port: 80, Seq: 291, Ack: 4727, Len: 0

No.     Time           Source                Destination           Protocol Length SEQ#       NEXT SEQ#  ACK#       Info                                                            Host       HTTP delta Stream index
     22 9.905866       209.177.86.18         24.6.173.220          HTTP     1514   4727       6187       291        Continuation                                                                          1

Frame 22: 1514 bytes on wire (12112 bits), 1514 bytes captured (12112 bits) on interface \Device\NPF_{6E79FEC0-FF79-4970-96E4-EEFF300A9B9F}, id 0
Ethernet II, Src: Cadant_31:bb:c1 (00:01:5c:31:bb:c1), Dst: HewlettP_a7:bf:a3 (d4:85:64:a7:bf:a3)
Internet Protocol Version 4, Src: 209.177.86.18, Dst: 24.6.173.220
Transmission Control Protocol, Src Port: 80, Dst Port: 61599, Seq: 4727, Ack: 291, Len: 1460
Hypertext Transfer Protocol

No.     Time           Source                Destination           Protocol Length SEQ#       NEXT SEQ#  ACK#       Info                                                            Host       HTTP delta Stream index
     23 9.905870       209.177.86.18         24.6.173.220          HTTP     1514   6187       7647       291        Continuation                                                                          1

Frame 23: 1514 bytes on wire (12112 bits), 1514 bytes captured (12112 bits) on interface \Device\NPF_{6E79FEC0-FF79-4970-96E4-EEFF300A9B9F}, id 0
Ethernet II, Src: Cadant_31:bb:c1 (00:01:5c:31:bb:c1), Dst: HewlettP_a7:bf:a3 (d4:85:64:a7:bf:a3)
Internet Protocol Version 4, Src: 209.177.86.18, Dst: 24.6.173.220
Transmission Control Protocol, Src Port: 80, Dst Port: 61599, Seq: 6187, Ack: 291, Len: 1460
Hypertext Transfer Protocol

No.     Time           Source                Destination           Protocol Length SEQ#       NEXT SEQ#  ACK#       Info                                                            Host       HTTP delta Stream index
     24 9.906623       24.6.173.220          209.177.86.18         TCP      54     291        291        7647       61599 → 80 [ACK] Seq=291 Ack=7647 Win=65700 Len=0                                   1

Frame 24: 54 bytes on wire (432 bits), 54 bytes captured (432 bits) on interface \Device\NPF_{6E79FEC0-FF79-4970-96E4-EEFF300A9B9F}, id 0
Ethernet II, Src: HewlettP_a7:bf:a3 (d4:85:64:a7:bf:a3), Dst: Cadant_31:bb:c1 (00:01:5c:31:bb:c1)
Internet Protocol Version 4, Src: 24.6.173.220, Dst: 209.177.86.18
Transmission Control Protocol, Src Port: 61599, Dst Port: 80, Seq: 291, Ack: 7647, Len: 0

No.     Time           Source                Destination           Protocol Length SEQ#       NEXT SEQ#  ACK#       Info                                                            Host       HTTP delta Stream index
     25 9.938061       24.6.173.220          75.75.75.75           DNS      75                                      Standard query 0xd531 A images.china.cn                                               

Frame 25: 75 bytes on wire (600 bits), 75 bytes captured (600 bits) on interface \Device\NPF_{6E79FEC0-FF79-4970-96E4-EEFF300A9B9F}, id 0
Ethernet II, Src: HewlettP_a7:bf:a3 (d4:85:64:a7:bf:a3), Dst: Cadant_31:bb:c1 (00:01:5c:31:bb:c1)
Internet Protocol Version 4, Src: 24.6.173.220, Dst: 75.75.75.75
User Datagram Protocol, Src Port: 58067, Dst Port: 53
Domain Name System (query)

No.     Time           Source                Destination           Protocol Length SEQ#       NEXT SEQ#  ACK#       Info                                                            Host       HTTP delta Stream index
     26 9.990695       209.177.86.18         24.6.173.220          HTTP     1514   7647       9107       291        Continuation                                                                          1

Frame 26: 1514 bytes on wire (12112 bits), 1514 bytes captured (12112 bits) on interface \Device\NPF_{6E79FEC0-FF79-4970-96E4-EEFF300A9B9F}, id 0
Ethernet II, Src: Cadant_31:bb:c1 (00:01:5c:31:bb:c1), Dst: HewlettP_a7:bf:a3 (d4:85:64:a7:bf:a3)
Internet Protocol Version 4, Src: 209.177.86.18, Dst: 24.6.173.220
Transmission Control Protocol, Src Port: 80, Dst Port: 61599, Seq: 7647, Ack: 291, Len: 1460
Hypertext Transfer Protocol

No.     Time           Source                Destination           Protocol Length SEQ#       NEXT SEQ#  ACK#       Info                                                            Host       HTTP delta Stream index
     27 9.991719       209.177.86.18         24.6.173.220          HTTP     1514   9107       10567      291        Continuation                                                                          1

Frame 27: 1514 bytes on wire (12112 bits), 1514 bytes captured (12112 bits) on interface \Device\NPF_{6E79FEC0-FF79-4970-96E4-EEFF300A9B9F}, id 0
Ethernet II, Src: Cadant_31:bb:c1 (00:01:5c:31:bb:c1), Dst: HewlettP_a7:bf:a3 (d4:85:64:a7:bf:a3)
Internet Protocol Version 4, Src: 209.177.86.18, Dst: 24.6.173.220
Transmission Control Protocol, Src Port: 80, Dst Port: 61599, Seq: 9107, Ack: 291, Len: 1460
Hypertext Transfer Protocol

No.     Time           Source                Destination           Protocol Length SEQ#       NEXT SEQ#  ACK#       Info                                                            Host       HTTP delta Stream index
     28 9.991727       209.177.86.18         24.6.173.220          HTTP     1514   10567      12027      291        Continuation                                                                          1

Frame 28: 1514 bytes on wire (12112 bits), 1514 bytes captured (12112 bits) on interface \Device\NPF_{6E79FEC0-FF79-4970-96E4-EEFF300A9B9F}, id 0
Ethernet II, Src: Cadant_31:bb:c1 (00:01:5c:31:bb:c1), Dst: HewlettP_a7:bf:a3 (d4:85:64:a7:bf:a3)
Internet Protocol Version 4, Src: 209.177.86.18, Dst: 24.6.173.220
Transmission Control Protocol, Src Port: 80, Dst Port: 61599, Seq: 10567, Ack: 291, Len: 1460
Hypertext Transfer Protocol

No.     Time           Source                Destination           Protocol Length SEQ#       NEXT SEQ#  ACK#       Info                                                            Host       HTTP delta Stream index
     29 9.992242       24.6.173.220          209.177.86.18         TCP      54     291        291        12027      61599 → 80 [ACK] Seq=291 Ack=12027 Win=65700 Len=0                                  1

Frame 29: 54 bytes on wire (432 bits), 54 bytes captured (432 bits) on interface \Device\NPF_{6E79FEC0-FF79-4970-96E4-EEFF300A9B9F}, id 0
Ethernet II, Src: HewlettP_a7:bf:a3 (d4:85:64:a7:bf:a3), Dst: Cadant_31:bb:c1 (00:01:5c:31:bb:c1)
Internet Protocol Version 4, Src: 24.6.173.220, Dst: 209.177.86.18
Transmission Control Protocol, Src Port: 61599, Dst Port: 80, Seq: 291, Ack: 12027, Len: 0

No.     Time           Source                Destination           Protocol Length SEQ#       NEXT SEQ#  ACK#       Info                                                            Host       HTTP delta Stream index
     30 9.993014       209.177.86.18         24.6.173.220          HTTP     1514   12027      13487      291        Continuation                                                                          1

Frame 30: 1514 bytes on wire (12112 bits), 1514 bytes captured (12112 bits) on interface \Device\NPF_{6E79FEC0-FF79-4970-96E4-EEFF300A9B9F}, id 0
Ethernet II, Src: Cadant_31:bb:c1 (00:01:5c:31:bb:c1), Dst: HewlettP_a7:bf:a3 (d4:85:64:a7:bf:a3)
Internet Protocol Version 4, Src: 209.177.86.18, Dst: 24.6.173.220
Transmission Control Protocol, Src Port: 80, Dst Port: 61599, Seq: 12027, Ack: 291, Len: 1460
Hypertext Transfer Protocol

No.     Time           Source                Destination           Protocol Length SEQ#       NEXT SEQ#  ACK#       Info                                                            Host       HTTP delta Stream index
     31 9.993016       209.177.86.18         24.6.173.220          HTTP     1514   13487      14947      291        Continuation                                                                          1

Frame 31: 1514 bytes on wire (12112 bits), 1514 bytes captured (12112 bits) on interface \Device\NPF_{6E79FEC0-FF79-4970-96E4-EEFF300A9B9F}, id 0
Ethernet II, Src: Cadant_31:bb:c1 (00:01:5c:31:bb:c1), Dst: HewlettP_a7:bf:a3 (d4:85:64:a7:bf:a3)
Internet Protocol Version 4, Src: 209.177.86.18, Dst: 24.6.173.220
Transmission Control Protocol, Src Port: 80, Dst Port: 61599, Seq: 13487, Ack: 291, Len: 1460
Hypertext Transfer Protocol

No.     Time           Source                Destination           Protocol Length SEQ#       NEXT SEQ#  ACK#       Info                                                            Host       HTTP delta Stream index
     32 9.993024       209.177.86.18         24.6.173.220          HTTP     1514   14947      16407      291        Continuation                                                                          1

Frame 32: 1514 bytes on wire (12112 bits), 1514 bytes captured (12112 bits) on interface \Device\NPF_{6E79FEC0-FF79-4970-96E4-EEFF300A9B9F}, id 0
Ethernet II, Src: Cadant_31:bb:c1 (00:01:5c:31:bb:c1), Dst: HewlettP_a7:bf:a3 (d4:85:64:a7:bf:a3)
Internet Protocol Version 4, Src: 209.177.86.18, Dst: 24.6.173.220
Transmission Control Protocol, Src Port: 80, Dst Port: 61599, Seq: 14947, Ack: 291, Len: 1460
Hypertext Transfer Protocol

No.     Time           Source                Destination           Protocol Length SEQ#       NEXT SEQ#  ACK#       Info                                                            Host       HTTP delta Stream index
     33 9.993759       24.6.173.220          209.177.86.18         TCP      54     291        291        16407      61599 → 80 [ACK] Seq=291 Ack=16407 Win=65700 Len=0                                  1

Frame 33: 54 bytes on wire (432 bits), 54 bytes captured (432 bits) on interface \Device\NPF_{6E79FEC0-FF79-4970-96E4-EEFF300A9B9F}, id 0
Ethernet II, Src: HewlettP_a7:bf:a3 (d4:85:64:a7:bf:a3), Dst: Cadant_31:bb:c1 (00:01:5c:31:bb:c1)
Internet Protocol Version 4, Src: 24.6.173.220, Dst: 209.177.86.18
Transmission Control Protocol, Src Port: 61599, Dst Port: 80, Seq: 291, Ack: 16407, Len: 0

No.     Time           Source                Destination           Protocol Length SEQ#       NEXT SEQ#  ACK#       Info                                                            Host       HTTP delta Stream index
     34 9.994525       209.177.86.18         24.6.173.220          HTTP     1514   16407      17867      291        Continuation                                                                          1

Frame 34: 1514 bytes on wire (12112 bits), 1514 bytes captured (12112 bits) on interface \Device\NPF_{6E79FEC0-FF79-4970-96E4-EEFF300A9B9F}, id 0
Ethernet II, Src: Cadant_31:bb:c1 (00:01:5c:31:bb:c1), Dst: HewlettP_a7:bf:a3 (d4:85:64:a7:bf:a3)
Internet Protocol Version 4, Src: 209.177.86.18, Dst: 24.6.173.220
Transmission Control Protocol, Src Port: 80, Dst Port: 61599, Seq: 16407, Ack: 291, Len: 1460
Hypertext Transfer Protocol

No.     Time           Source                Destination           Protocol Length SEQ#       NEXT SEQ#  ACK#       Info                                                            Host       HTTP delta Stream index
     35 9.994527       209.177.86.18         24.6.173.220          HTTP     1514   17867      19327      291        Continuation                                                                          1

Frame 35: 1514 bytes on wire (12112 bits), 1514 bytes captured (12112 bits) on interface \Device\NPF_{6E79FEC0-FF79-4970-96E4-EEFF300A9B9F}, id 0
Ethernet II, Src: Cadant_31:bb:c1 (00:01:5c:31:bb:c1), Dst: HewlettP_a7:bf:a3 (d4:85:64:a7:bf:a3)
Internet Protocol Version 4, Src: 209.177.86.18, Dst: 24.6.173.220
Transmission Control Protocol, Src Port: 80, Dst Port: 61599, Seq: 17867, Ack: 291, Len: 1460
Hypertext Transfer Protocol

No.     Time           Source                Destination           Protocol Length SEQ#       NEXT SEQ#  ACK#       Info                                                            Host       HTTP delta Stream index
     36 9.994954       24.6.173.220          209.177.86.18         TCP      54     291        291        19327      61599 → 80 [ACK] Seq=291 Ack=19327 Win=65700 Len=0                                  1

Frame 36: 54 bytes on wire (432 bits), 54 bytes captured (432 bits) on interface \Device\NPF_{6E79FEC0-FF79-4970-96E4-EEFF300A9B9F}, id 0
Ethernet II, Src: HewlettP_a7:bf:a3 (d4:85:64:a7:bf:a3), Dst: Cadant_31:bb:c1 (00:01:5c:31:bb:c1)
Internet Protocol Version 4, Src: 24.6.173.220, Dst: 209.177.86.18
Transmission Control Protocol, Src Port: 61599, Dst Port: 80, Seq: 291, Ack: 19327, Len: 0

No.     Time           Source                Destination           Protocol Length SEQ#       NEXT SEQ#  ACK#       Info                                                            Host       HTTP delta Stream index
     37 10.077004      209.177.86.18         24.6.173.220          HTTP     1514   19327      20787      291        Continuation                                                                          1

Frame 37: 1514 bytes on wire (12112 bits), 1514 bytes captured (12112 bits) on interface \Device\NPF_{6E79FEC0-FF79-4970-96E4-EEFF300A9B9F}, id 0
Ethernet II, Src: Cadant_31:bb:c1 (00:01:5c:31:bb:c1), Dst: HewlettP_a7:bf:a3 (d4:85:64:a7:bf:a3)
Internet Protocol Version 4, Src: 209.177.86.18, Dst: 24.6.173.220
Transmission Control Protocol, Src Port: 80, Dst Port: 61599, Seq: 19327, Ack: 291, Len: 1460
Hypertext Transfer Protocol

No.     Time           Source                Destination           Protocol Length SEQ#       NEXT SEQ#  ACK#       Info                                                            Host       HTTP delta Stream index
     38 10.078241      209.177.86.18         24.6.173.220          HTTP     1514   20787      22247      291        Continuation                                                                          1

Frame 38: 1514 bytes on wire (12112 bits), 1514 bytes captured (12112 bits) on interface \Device\NPF_{6E79FEC0-FF79-4970-96E4-EEFF300A9B9F}, id 0
Ethernet II, Src: Cadant_31:bb:c1 (00:01:5c:31:bb:c1), Dst: HewlettP_a7:bf:a3 (d4:85:64:a7:bf:a3)
Internet Protocol Version 4, Src: 209.177.86.18, Dst: 24.6.173.220
Transmission Control Protocol, Src Port: 80, Dst Port: 61599, Seq: 20787, Ack: 291, Len: 1460
Hypertext Transfer Protocol

No.     Time           Source                Destination           Protocol Length SEQ#       NEXT SEQ#  ACK#       Info                                                            Host       HTTP delta Stream index
     39 10.078252      209.177.86.18         24.6.173.220          HTTP     1514   22247      23707      291        Continuation                                                                          1

Frame 39: 1514 bytes on wire (12112 bits), 1514 bytes captured (12112 bits) on interface \Device\NPF_{6E79FEC0-FF79-4970-96E4-EEFF300A9B9F}, id 0
Ethernet II, Src: Cadant_31:bb:c1 (00:01:5c:31:bb:c1), Dst: HewlettP_a7:bf:a3 (d4:85:64:a7:bf:a3)
Internet Protocol Version 4, Src: 209.177.86.18, Dst: 24.6.173.220
Transmission Control Protocol, Src Port: 80, Dst Port: 61599, Seq: 22247, Ack: 291, Len: 1460
Hypertext Transfer Protocol

No.     Time           Source                Destination           Protocol Length SEQ#       NEXT SEQ#  ACK#       Info                                                            Host       HTTP delta Stream index
     40 10.078255      209.177.86.18         24.6.173.220          HTTP     1514   23707      25167      291        Continuation                                                                          1

Frame 40: 1514 bytes on wire (12112 bits), 1514 bytes captured (12112 bits) on interface \Device\NPF_{6E79FEC0-FF79-4970-96E4-EEFF300A9B9F}, id 0
Ethernet II, Src: Cadant_31:bb:c1 (00:01:5c:31:bb:c1), Dst: HewlettP_a7:bf:a3 (d4:85:64:a7:bf:a3)
Internet Protocol Version 4, Src: 209.177.86.18, Dst: 24.6.173.220
Transmission Control Protocol, Src Port: 80, Dst Port: 61599, Seq: 23707, Ack: 291, Len: 1460
Hypertext Transfer Protocol

No.     Time           Source                Destination           Protocol Length SEQ#       NEXT SEQ#  ACK#       Info                                                            Host       HTTP delta Stream index
     41 10.079428      24.6.173.220          209.177.86.18         TCP      54     291        291        25167      61599 → 80 [ACK] Seq=291 Ack=25167 Win=65700 Len=0                                  1

Frame 41: 54 bytes on wire (432 bits), 54 bytes captured (432 bits) on interface \Device\NPF_{6E79FEC0-FF79-4970-96E4-EEFF300A9B9F}, id 0
Ethernet II, Src: HewlettP_a7:bf:a3 (d4:85:64:a7:bf:a3), Dst: Cadant_31:bb:c1 (00:01:5c:31:bb:c1)
Internet Protocol Version 4, Src: 24.6.173.220, Dst: 209.177.86.18
Transmission Control Protocol, Src Port: 61599, Dst Port: 80, Seq: 291, Ack: 25167, Len: 0

No.     Time           Source                Destination           Protocol Length SEQ#       NEXT SEQ#  ACK#       Info                                                            Host       HTTP delta Stream index
     42 10.081832      209.177.86.18         24.6.173.220          HTTP     1514   25167      26627      291        Continuation                                                                          1

Frame 42: 1514 bytes on wire (12112 bits), 1514 bytes captured (12112 bits) on interface \Device\NPF_{6E79FEC0-FF79-4970-96E4-EEFF300A9B9F}, id 0
Ethernet II, Src: Cadant_31:bb:c1 (00:01:5c:31:bb:c1), Dst: HewlettP_a7:bf:a3 (d4:85:64:a7:bf:a3)
Internet Protocol Version 4, Src: 209.177.86.18, Dst: 24.6.173.220
Transmission Control Protocol, Src Port: 80, Dst Port: 61599, Seq: 25167, Ack: 291, Len: 1460
Hypertext Transfer Protocol

No.     Time           Source                Destination           Protocol Length SEQ#       NEXT SEQ#  ACK#       Info                                                            Host       HTTP delta Stream index
     43 10.083263      209.177.86.18         24.6.173.220          HTTP     1514   26627      28087      291        Continuation                                                                          1

Frame 43: 1514 bytes on wire (12112 bits), 1514 bytes captured (12112 bits) on interface \Device\NPF_{6E79FEC0-FF79-4970-96E4-EEFF300A9B9F}, id 0
Ethernet II, Src: Cadant_31:bb:c1 (00:01:5c:31:bb:c1), Dst: HewlettP_a7:bf:a3 (d4:85:64:a7:bf:a3)
Internet Protocol Version 4, Src: 209.177.86.18, Dst: 24.6.173.220
Transmission Control Protocol, Src Port: 80, Dst Port: 61599, Seq: 26627, Ack: 291, Len: 1460
Hypertext Transfer Protocol

No.     Time           Source                Destination           Protocol Length SEQ#       NEXT SEQ#  ACK#       Info                                                            Host       HTTP delta Stream index
     44 10.083269      209.177.86.18         24.6.173.220          HTTP     1514   28087      29547      291        Continuation                                                                          1

Frame 44: 1514 bytes on wire (12112 bits), 1514 bytes captured (12112 bits) on interface \Device\NPF_{6E79FEC0-FF79-4970-96E4-EEFF300A9B9F}, id 0
Ethernet II, Src: Cadant_31:bb:c1 (00:01:5c:31:bb:c1), Dst: HewlettP_a7:bf:a3 (d4:85:64:a7:bf:a3)
Internet Protocol Version 4, Src: 209.177.86.18, Dst: 24.6.173.220
Transmission Control Protocol, Src Port: 80, Dst Port: 61599, Seq: 28087, Ack: 291, Len: 1460
Hypertext Transfer Protocol

No.     Time           Source                Destination           Protocol Length SEQ#       NEXT SEQ#  ACK#       Info                                                            Host       HTTP delta Stream index
     45 10.083276      209.177.86.18         24.6.173.220          HTTP     1514   29547      31007      291        Continuation                                                                          1

Frame 45: 1514 bytes on wire (12112 bits), 1514 bytes captured (12112 bits) on interface \Device\NPF_{6E79FEC0-FF79-4970-96E4-EEFF300A9B9F}, id 0
Ethernet II, Src: Cadant_31:bb:c1 (00:01:5c:31:bb:c1), Dst: HewlettP_a7:bf:a3 (d4:85:64:a7:bf:a3)
Internet Protocol Version 4, Src: 209.177.86.18, Dst: 24.6.173.220
Transmission Control Protocol, Src Port: 80, Dst Port: 61599, Seq: 29547, Ack: 291, Len: 1460
Hypertext Transfer Protocol

No.     Time           Source                Destination           Protocol Length SEQ#       NEXT SEQ#  ACK#       Info                                                            Host       HTTP delta Stream index
     46 10.084488      24.6.173.220          209.177.86.18         TCP      54     291        291        31007      61599 → 80 [ACK] Seq=291 Ack=31007 Win=65700 Len=0                                  1

Frame 46: 54 bytes on wire (432 bits), 54 bytes captured (432 bits) on interface \Device\NPF_{6E79FEC0-FF79-4970-96E4-EEFF300A9B9F}, id 0
Ethernet II, Src: HewlettP_a7:bf:a3 (d4:85:64:a7:bf:a3), Dst: Cadant_31:bb:c1 (00:01:5c:31:bb:c1)
Internet Protocol Version 4, Src: 24.6.173.220, Dst: 209.177.86.18
Transmission Control Protocol, Src Port: 61599, Dst Port: 80, Seq: 291, Ack: 31007, Len: 0

No.     Time           Source                Destination           Protocol Length SEQ#       NEXT SEQ#  ACK#       Info                                                            Host       HTTP delta Stream index
     47 10.086384      24.6.173.220          75.75.75.75           DNS      89                                      Standard query 0x56c9 A pagead2.googlesyndication.com                                 

Frame 47: 89 bytes on wire (712 bits), 89 bytes captured (712 bits) on interface \Device\NPF_{6E79FEC0-FF79-4970-96E4-EEFF300A9B9F}, id 0
Ethernet II, Src: HewlettP_a7:bf:a3 (d4:85:64:a7:bf:a3), Dst: Cadant_31:bb:c1 (00:01:5c:31:bb:c1)
Internet Protocol Version 4, Src: 24.6.173.220, Dst: 75.75.75.75
User Datagram Protocol, Src Port: 60293, Dst Port: 53
Domain Name System (query)

No.     Time           Source                Destination           Protocol Length SEQ#       NEXT SEQ#  ACK#       Info                                                            Host       HTTP delta Stream index
     48 10.100835      75.75.75.75           24.6.173.220          DNS      177                                     Standard query response 0x56c9 A pagead2.googlesyndication.com CNAME pagead46.l.doubleclick.net A 74.125.224.154 A 74.125.224.141 A 74.125.224.153                       

